hotel_names,rating,coordinates,description,links,town
Hôtel des Halles,8.9,"5.03691829741001,47.3255814185703","L'Hôtel des Halles vous accueille dans le centre-ville historique de Dijon, à 50 mètres de la zone piétonne et à 300 mètres du marché couvert des halles centrales. ",www.booking.com/hotel/fr/hotel-des-halles-dijon.fr.html?label=gen173nr-1FCAQoggJCDHNlYXJjaF9kaWpvbkgNWARoqQGIAQGYAQ24ARjIAQXYAQHoAQH4AQOIAgGoAgS4AuyfnYoGwAIB0gIkNzRjODVjNGQtOGYxMy00YWI5LWJmNTktNzhjNmY2YzliMTE52AIF4AIB&sid=c7eb83fca043f97e289318ae6bbe24ec&dest_id=-1423981&dest_type=city&group_adults=2&group_children=0&hapos=2&hpos=2&no_rooms=1&sr_order=popularity&srepoch=1632063469&srpvid=adca69362f360040&ucfs=1&from=searchresults;highlight_room=#hotelTmpl,Dijon
"Holiday Inn Express Dijon, an IHG Hotel",8.3,"5.07608726620674,47.3269991049702","Situé à Saint-Apollinaire, l'Holiday Inn Express Dijon possède une piscine extérieure. Cet établissement climatisé propose une réception ouverte 24h/24, une terrasse bien exposée et un bar. ",www.booking.com/hotel/fr/holiday-inn-express-dijon.fr.html?label=gen173nr-1FCAQoggJCDHNlYXJjaF9kaWpvbkgNWARoqQGIAQGYAQ24ARjIAQXYAQHoAQH4AQOIAgGoAgS4AuyfnYoGwAIB0gIkNzRjODVjNGQtOGYxMy00YWI5LWJmNTktNzhjNmY2YzliMTE52AIF4AIB&sid=c7eb83fca043f97e289318ae6bbe24ec&dest_id=-1423981&dest_type=city&group_adults=2&group_children=0&hapos=3&hpos=3&no_rooms=1&sr_order=popularity&srepoch=1632063469&srpvid=adca69362f360040&ucfs=1&from=searchresults;highlight_room=#hotelTmpl,Dijon
Hôtel Restaurant initial by balladins Dijon Nord,7.6,"5.0696673989296,47.3512156584435","Situé à 12 minutes en voiture du centre-ville de Dijon, l'Hôtel Balladins Dijon Nord possède des chambres climatisées avec connexion Wi-Fi gratuite, des salles de réunion et un restaurant. ",www.booking.com/hotel/fr/hotel-balladins-dijon-nord-superior.fr.html?label=gen173nr-1FCAQoggJCDHNlYXJjaF9kaWpvbkgNWARoqQGIAQGYAQ24ARjIAQXYAQHoAQH4AQOIAgGoAgS4AuyfnYoGwAIB0gIkNzRjODVjNGQtOGYxMy00YWI5LWJmNTktNzhjNmY2YzliMTE52AIF4AIB&sid=c7eb83fca043f97e289318ae6bbe24ec&dest_id=-1423981&dest_type=city&group_adults=2&group_children=0&hapos=4&hpos=4&no_rooms=1&sr_order=popularity&srepoch=1632063469&srpvid=adca69362f360040&ucfs=1&from=searchresults;highlight_room=#hotelTmpl,Dijon
Hôtel République,8.3,"5.04478052258492,47.3257014120902",Cette auberge du XVIIIe siècle est située dans une rue calme du centre historique de Dijon. Elle vous accueille dans un cadre moderne et élégant avec connexion Wi-Fi gratuite. ,www.booking.com/hotel/fr/republique-dijon.fr.html?label=gen173nr-1FCAQoggJCDHNlYXJjaF9kaWpvbkgNWARoqQGIAQGYAQ24ARjIAQXYAQHoAQH4AQOIAgGoAgS4AuyfnYoGwAIB0gIkNzRjODVjNGQtOGYxMy00YWI5LWJmNTktNzhjNmY2YzliMTE52AIF4AIB&sid=c7eb83fca043f97e289318ae6bbe24ec&dest_id=-1423981&dest_type=city&group_adults=2&group_children=0&hapos=5&hpos=5&no_rooms=1&sr_order=popularity&srepoch=1632063469&srpvid=adca69362f360040&ucfs=1&from=searchresults;highlight_room=#hotelTmpl,Dijon
ibis Dijon Gare,8.0,"5.0238861143589,47.3222314894531","L'hôtel ibis Dijon Gare est situé en face de la gare, à seulement 10 minutes à pied du centre-ville historique. ",www.booking.com/hotel/fr/ibis-dijon-gare.fr.html?label=gen173nr-1FCAQoggJCDHNlYXJjaF9kaWpvbkgNWARoqQGIAQGYAQ24ARjIAQXYAQHoAQH4AQOIAgGoAgS4AuyfnYoGwAIB0gIkNzRjODVjNGQtOGYxMy00YWI5LWJmNTktNzhjNmY2YzliMTE52AIF4AIB&sid=c7eb83fca043f97e289318ae6bbe24ec&dest_id=-1423981&dest_type=city&group_adults=2&group_children=0&hapos=6&hpos=6&no_rooms=1&sr_order=popularity&srepoch=1632063469&srpvid=adca69362f360040&ucfs=1&from=searchresults;highlight_room=#hotelTmpl,Dijon
Novotel Dijon Route des Grands Crus,7.4,"5.00770568847656,47.2795274293251","Situé sur la route des vins de Bourgogne, le Novotel Dijon Route des Grands Crus se trouve à 10 minutes de Dijon, dans la région des vignobles de Marsannay-la-Côte. ",www.booking.com/hotel/fr/novotel-dijon-sud.fr.html?label=gen173nr-1FCAQoggJCDHNlYXJjaF9kaWpvbkgNWARoqQGIAQGYAQ24ARjIAQXYAQHoAQH4AQOIAgGoAgS4AuyfnYoGwAIB0gIkNzRjODVjNGQtOGYxMy00YWI5LWJmNTktNzhjNmY2YzliMTE52AIF4AIB&sid=c7eb83fca043f97e289318ae6bbe24ec&dest_id=-1423981&dest_type=city&group_adults=2&group_children=0&hapos=7&hpos=7&no_rooms=1&sr_order=popularity&srepoch=1632063469&srpvid=adca69362f360040&ucfs=1&from=searchresults;highlight_room=#hotelTmpl,Dijon
City Loft Apparthotel,8.4,"5.03817558288574,47.322686946839","Idéalement situé au cœur du quartier piétonnier, le City Loft Apparthotel se trouve près du palais des ducs. ",www.booking.com/hotel/fr/city-loft.fr.html?label=gen173nr-1FCAQoggJCDHNlYXJjaF9kaWpvbkgNWARoqQGIAQGYAQ24ARjIAQXYAQHoAQH4AQOIAgGoAgS4AuyfnYoGwAIB0gIkNzRjODVjNGQtOGYxMy00YWI5LWJmNTktNzhjNmY2YzliMTE52AIF4AIB&sid=c7eb83fca043f97e289318ae6bbe24ec&dest_id=-1423981&dest_type=city&group_adults=2&group_children=0&hapos=8&hpos=8&no_rooms=1&sr_order=popularity&srepoch=1632063469&srpvid=adca69362f360040&ucfs=1&from=searchresults;highlight_room=#hotelTmpl,Dijon
Kyriad Hotel Dijon Gare,7.4,"5.02989828586578,47.3227960378455",Le Kyriad Hotel Dijon Gare vous accueille à 120 mètres de la gare de Dijon. Il dispose d'une piscine intérieure et de chambres insonorisées avec une connexion Wi-Fi gratuite. ,www.booking.com/hotel/fr/kyriad-gare.fr.html?label=gen173nr-1FCAQoggJCDHNlYXJjaF9kaWpvbkgNWARoqQGIAQGYAQ24ARjIAQXYAQHoAQH4AQOIAgGoAgS4AuyfnYoGwAIB0gIkNzRjODVjNGQtOGYxMy00YWI5LWJmNTktNzhjNmY2YzliMTE52AIF4AIB&sid=c7eb83fca043f97e289318ae6bbe24ec&dest_id=-1423981&dest_type=city&group_adults=2&group_children=0&hapos=9&hpos=9&no_rooms=1&sr_order=popularity&srepoch=1632063469&srpvid=adca69362f360040&ucfs=1&from=searchresults;highlight_room=#hotelTmpl,Dijon
Ethic Etapes Dijon,7.2,"5.06139278411865,47.3363988296989","L'Ethic Etapes Dijon est situé à Dijon, à 800 mètres d'une route d'accès à l'autoroute A6 et à 4 km de la gare de Dijon-Ville. Il propose une connexion Wi-Fi gratuite et une réception ouverte 24h/24. ",www.booking.com/hotel/fr/ethic-etapes-dijon.fr.html?label=gen173nr-1FCAQoggJCDHNlYXJjaF9kaWpvbkgNWARoqQGIAQGYAQ24ARjIAQXYAQHoAQH4AQOIAgGoAgS4AuyfnYoGwAIB0gIkNzRjODVjNGQtOGYxMy00YWI5LWJmNTktNzhjNmY2YzliMTE52AIF4AIB&sid=c7eb83fca043f97e289318ae6bbe24ec&dest_id=-1423981&dest_type=city&group_adults=2&group_children=0&hapos=10&hpos=10&no_rooms=1&sr_order=popularity&srepoch=1632063469&srpvid=adca69362f360040&ucfs=1&from=searchresults;highlight_room=#hotelTmpl,Dijon
Appart L'avant Scene Tresums,8.2,"6.12978489057923,45.8955966794831","Situé à 600 mètres du palais de l'Île, l'Appart L'avant Scene Tresums vous propose un jardin et une terrasse, ainsi que des hébergements climatisés avec un balcon et une connexion Wi-Fi gratuite. ",www.booking.com/hotel/fr/apparte-l-avant-scene-tresums.fr.html?label=gen173nr-1FCAQoggJCDXNlYXJjaF9hbm5lY3lIDVgEaKkBiAEBmAENuAEYyAEF2AEB6AEB-AEDiAIBqAIEuALun52KBsACAdICJDQzZjVhMDYwLTA1NGYtNGE3My1hNGEwLTAyMTUzZmM0Nzk1ONgCBeACAQ&sid=8e2c64605d02de7b2335a0a6c92d1394&dest_id=-1407760&dest_type=city&group_adults=2&group_children=0&hapos=1&hpos=1&no_rooms=1&sr_order=popularity&srepoch=1632063470&srpvid=341c69379bc900bd&ucfs=1&from=searchresults;highlight_room=;from_sr_card=1#hotelTmpl,Annecy
Ace Hotel Annecy,8.3,"6.09713047742844,45.8800899491911","Doté d'une réception ouverte 24h/24, l'Ace Hotel Annecy est situé à Seynod, à moins de 5 km du lac d'Annecy et du centre-ville d'Annecy. ",www.booking.com/hotel/fr/ace-annecy.fr.html?label=gen173nr-1FCAQoggJCDXNlYXJjaF9hbm5lY3lIDVgEaKkBiAEBmAENuAEYyAEF2AEB6AEB-AEDiAIBqAIEuALun52KBsACAdICJDQzZjVhMDYwLTA1NGYtNGE3My1hNGEwLTAyMTUzZmM0Nzk1ONgCBeACAQ&sid=8e2c64605d02de7b2335a0a6c92d1394&dest_id=-1407760&dest_type=city&group_adults=2&group_children=0&hapos=2&hpos=2&no_rooms=1&sr_order=popularity&srepoch=1632063470&srpvid=341c69379bc900bd&ucfs=1&from=searchresults;highlight_room=;from_sr_card=1#hotelTmpl,Annecy
Hôtel des Alpes,8.6,"6.12292528152466,45.9016303829646","L'Hôtel des Alpes propose un hébergement 2 étoiles à 10 minutes à pied du lac d'Annecy et à 100 mètres de la gare. La vieille ville, les boutiques et les restaurants sont accessibles à pied. ",www.booking.com/hotel/fr/hotel-des-alpes.fr.html?label=gen173nr-1FCAQoggJCDXNlYXJjaF9hbm5lY3lIDVgEaKkBiAEBmAENuAEYyAEF2AEB6AEB-AEDiAIBqAIEuALun52KBsACAdICJDQzZjVhMDYwLTA1NGYtNGE3My1hNGEwLTAyMTUzZmM0Nzk1ONgCBeACAQ&sid=8e2c64605d02de7b2335a0a6c92d1394&dest_id=-1407760&dest_type=city&group_adults=2&group_children=0&hapos=3&hpos=3&no_rooms=1&sr_order=popularity&srepoch=1632063470&srpvid=341c69379bc900bd&ucfs=1&from=searchresults;highlight_room=;from_sr_card=1#hotelTmpl,Annecy
Best Western Hotel International,8.0,"6.11575841903687,45.8999896799377","Doté d'une salle de sport avec un hammam et un jacuzzi, le Best Western Hotel International est situé à l'entrée d'Annecy, à 2 km du lac d'Annecy et du centre-ville. ",www.booking.com/hotel/fr/best-western-international.fr.html?label=gen173nr-1FCAQoggJCDXNlYXJjaF9hbm5lY3lIDVgEaKkBiAEBmAENuAEYyAEF2AEB6AEB-AEDiAIBqAIEuALun52KBsACAdICJDQzZjVhMDYwLTA1NGYtNGE3My1hNGEwLTAyMTUzZmM0Nzk1ONgCBeACAQ&sid=8e2c64605d02de7b2335a0a6c92d1394&dest_id=-1407760&dest_type=city&group_adults=2&group_children=0&hapos=4&hpos=4&no_rooms=1&sr_order=popularity&srepoch=1632063470&srpvid=341c69379bc900bd&ucfs=1&from=searchresults;highlight_room=;from_sr_card=1#hotelTmpl,Annecy
Hôtel du Château,8.7,"6.12520515918732,45.8978934666232","Offrant une vue sur la vieille ville, l’Hotel du Chateau est situé au pied du château d’Annecy. Sa réception est dotée d’une connexion Wi-Fi gratuite. ",www.booking.com/hotel/fr/du-chateau-annecy.fr.html?label=gen173nr-1FCAQoggJCDXNlYXJjaF9hbm5lY3lIDVgEaKkBiAEBmAENuAEYyAEF2AEB6AEB-AEDiAIBqAIEuALun52KBsACAdICJDQzZjVhMDYwLTA1NGYtNGE3My1hNGEwLTAyMTUzZmM0Nzk1ONgCBeACAQ&sid=8e2c64605d02de7b2335a0a6c92d1394&dest_id=-1407760&dest_type=city&group_adults=2&group_children=0&hapos=5&hpos=5&no_rooms=1&sr_order=popularity&srepoch=1632063470&srpvid=341c69379bc900bd&ucfs=1&from=searchresults;highlight_room=;from_sr_card=1#hotelTmpl,Annecy
Centre Jean XXIII,7.6,"6.15250679999997,45.9183227","Doté d’une terrasse bien exposée, le Centre Jean XXIII se trouve à Annecy, à 1,8 km du lac et à 3 km de la vieille ville. ",www.booking.com/hotel/fr/centre-jean-xxiii.fr.html?label=gen173nr-1FCAQoggJCDXNlYXJjaF9hbm5lY3lIDVgEaKkBiAEBmAENuAEYyAEF2AEB6AEB-AEDiAIBqAIEuALun52KBsACAdICJDQzZjVhMDYwLTA1NGYtNGE3My1hNGEwLTAyMTUzZmM0Nzk1ONgCBeACAQ&sid=8e2c64605d02de7b2335a0a6c92d1394&dest_id=-1407760&dest_type=city&group_adults=2&group_children=0&hapos=6&hpos=6&no_rooms=1&sr_order=popularity&srepoch=1632063470&srpvid=341c69379bc900bd&ucfs=1&from=searchresults;highlight_room=;from_sr_card=1#hotelTmpl,Annecy
Best Western Plus Hotel Carlton Annecy,8.4,"6.12239420413971,45.9003480628944","Le Best Western Carlton Annecy est installé dans le centre d'Annecy, aux portes de la ville médiévale. Le lac d'Annecy se trouve à 10 minutes à pied. ",www.booking.com/hotel/fr/bestwesterncarlton.fr.html?label=gen173nr-1FCAQoggJCDXNlYXJjaF9hbm5lY3lIDVgEaKkBiAEBmAENuAEYyAEF2AEB6AEB-AEDiAIBqAIEuALun52KBsACAdICJDQzZjVhMDYwLTA1NGYtNGE3My1hNGEwLTAyMTUzZmM0Nzk1ONgCBeACAQ&sid=8e2c64605d02de7b2335a0a6c92d1394&dest_id=-1407760&dest_type=city&group_adults=2&group_children=0&hapos=7&hpos=7&no_rooms=1&sr_order=popularity&srepoch=1632063470&srpvid=341c69379bc900bd&ucfs=1&from=searchresults;highlight_room=;from_sr_card=1#hotelTmpl,Annecy
Zenitude Hôtel-Résidences Les Hauts d'Annecy,7.0,"6.107753,45.890749","Le Zenitude Hôtel - Résidences Les Hauts d’Annecy se situe à Seynod, à 3 km du lac d’Annecy et à 2 km du centre-ville. ",www.booking.com/hotel/fr/appart-city-annecy-seynod.fr.html?label=gen173nr-1FCAQoggJCDXNlYXJjaF9hbm5lY3lIDVgEaKkBiAEBmAENuAEYyAEF2AEB6AEB-AEDiAIBqAIEuALun52KBsACAdICJDQzZjVhMDYwLTA1NGYtNGE3My1hNGEwLTAyMTUzZmM0Nzk1ONgCBeACAQ&sid=8e2c64605d02de7b2335a0a6c92d1394&dest_id=-1407760&dest_type=city&group_adults=2&group_children=0&hapos=8&hpos=8&no_rooms=1&sr_order=popularity&srepoch=1632063470&srpvid=341c69379bc900bd&ucfs=1&from=searchresults;highlight_room=;from_sr_card=1#hotelTmpl,Annecy
Atipik Hôtel Alexandra,8.5,"6.12507373094559,45.9012272112874","Installé à 200 mètres des rives du lac d'Annecy, l'Atipik Hôtel Alexandra se trouve à l'entrée de la vieille ville médiévale ainsi que de ses rues piétonnes et commerçantes. ",www.booking.com/hotel/fr/hotelalexandra.fr.html?label=gen173nr-1FCAQoggJCDXNlYXJjaF9hbm5lY3lIDVgEaKkBiAEBmAENuAEYyAEF2AEB6AEB-AEDiAIBqAIEuALun52KBsACAdICJDQzZjVhMDYwLTA1NGYtNGE3My1hNGEwLTAyMTUzZmM0Nzk1ONgCBeACAQ&sid=8e2c64605d02de7b2335a0a6c92d1394&dest_id=-1407760&dest_type=city&group_adults=2&group_children=0&hapos=9&hpos=9&no_rooms=1&sr_order=popularity&srepoch=1632063470&srpvid=341c69379bc900bd&ucfs=1&from=searchresults;highlight_room=;from_sr_card=1#hotelTmpl,Annecy
le panorama du lac,8.0,"6.13043418415962,45.8946446762173","Offrant une vue sur la montagne, le panorama du lac propose un hébergement avec une terrasse et une bouilloire, à environ 500 mètres du palais de l'Isle. ",www.booking.com/hotel/fr/le-panorama-du-lac.fr.html?label=gen173nr-1FCAQoggJCDXNlYXJjaF9hbm5lY3lIDVgEaKkBiAEBmAENuAEYyAEF2AEB6AEB-AEDiAIBqAIEuALun52KBsACAdICJDQzZjVhMDYwLTA1NGYtNGE3My1hNGEwLTAyMTUzZmM0Nzk1ONgCBeACAQ&sid=8e2c64605d02de7b2335a0a6c92d1394&dest_id=-1407760&dest_type=city&group_adults=2&group_children=0&hapos=10&hpos=10&no_rooms=1&sr_order=popularity&srepoch=1632063470&srpvid=341c69379bc900bd&ucfs=1&from=searchresults;highlight_room=;from_sr_card=1#hotelTmpl,Annecy
ibis Grenoble Centre Bastille,7.5,"5.72641227514646,45.1905251822297","Situé dans le centre-ville de Grenoble, l'ibis Grenoble Centre Bastille propose une réception ouverte 24h/24 et un bar. ",www.booking.com/hotel/fr/ibis-grenoble-centre.fr.html?label=gen173nr-1FCAQoggJCD3NlYXJjaF9ncmVub2JsZUgNWARoqQGIAQGYAQ24ARjIAQXYAQHoAQH4AQOIAgGoAgS4AvGfnYoGwAIB0gIkNTkyMWU0OTktMGQ4NS00M2E0LWI1YmMtOTM3OTVhNTE5MmY02AIF4AIB&sid=1a531b5936d7b08d2a734b6bc50337d4&dest_id=-1430647&dest_type=city&group_adults=2&group_children=0&hapos=1&hpos=1&no_rooms=1&sr_order=popularity&srepoch=1632063473&srpvid=4b576938424f016e&ucfs=1&from=searchresults;highlight_room=#hotelTmpl,Grenoble
ibis Grenoble Gare,7.8,"5.71739092480129,45.1928980034278","Situé à seulement 200 mètres de la gare de Grenoble, l'ibis Grenoble Gare possède des chambres climatisées offrant une vue sur la montagne et dotées d'une connexion Wi-Fi gratuite. ",www.booking.com/hotel/fr/ibis-grenoble-gare.fr.html?label=gen173nr-1FCAQoggJCD3NlYXJjaF9ncmVub2JsZUgNWARoqQGIAQGYAQ24ARjIAQXYAQHoAQH4AQOIAgGoAgS4AvGfnYoGwAIB0gIkNTkyMWU0OTktMGQ4NS00M2E0LWI1YmMtOTM3OTVhNTE5MmY02AIF4AIB&sid=1a531b5936d7b08d2a734b6bc50337d4&dest_id=-1430647&dest_type=city&group_adults=2&group_children=0&hapos=2&hpos=2&no_rooms=1&sr_order=popularity&srepoch=1632063473&srpvid=4b576938424f016e&ucfs=1&from=searchresults;highlight_room=#hotelTmpl,Grenoble
Maison Barbillon Grenoble,8.2,"5.71669667959213,45.1907932968609","La Maison Barbillon Grenoble vous accueille à Grenoble, à seulement 100 mètres de la gare. ",www.booking.com/hotel/fr/maison-barbillon-grenoble.fr.html?label=gen173nr-1FCAQoggJCD3NlYXJjaF9ncmVub2JsZUgNWARoqQGIAQGYAQ24ARjIAQXYAQHoAQH4AQOIAgGoAgS4AvGfnYoGwAIB0gIkNTkyMWU0OTktMGQ4NS00M2E0LWI1YmMtOTM3OTVhNTE5MmY02AIF4AIB&sid=1a531b5936d7b08d2a734b6bc50337d4&dest_id=-1430647&dest_type=city&group_adults=2&group_children=0&hapos=3&hpos=3&no_rooms=1&sr_order=popularity&srepoch=1632063473&srpvid=4b576938424f016e&ucfs=1&from=searchresults;highlight_room=#hotelTmpl,Grenoble
Le Hüb hostel - Grenoble,7.6,"5.711917,45.192873","L’auberge de jeunesse Le Hüb hostel - Grenoble vous accueille à Grenoble, à 300 mètres du centre des congrès du WTC. Elle possède un bar, un parking privé, un salon commun, un jardin et une terrasse. ",www.booking.com/hotel/fr/le-hub-hostel-grenoble.fr.html?label=gen173nr-1FCAQoggJCD3NlYXJjaF9ncmVub2JsZUgNWARoqQGIAQGYAQ24ARjIAQXYAQHoAQH4AQOIAgGoAgS4AvGfnYoGwAIB0gIkNTkyMWU0OTktMGQ4NS00M2E0LWI1YmMtOTM3OTVhNTE5MmY02AIF4AIB&sid=1a531b5936d7b08d2a734b6bc50337d4&dest_id=-1430647&dest_type=city&group_adults=2&group_children=0&hapos=4&hpos=4&no_rooms=1&sr_order=popularity&srepoch=1632063473&srpvid=4b576938424f016e&ucfs=1&from=searchresults;highlight_room=#hotelTmpl,Grenoble
Novotel Grenoble Centre,7.8,"5.71259558200836,45.1906950021105","Le Novotel Grenoble Centre est installé au cœur du quartier des affaires de Grenoble, à seulement quelques pas de la gare TGV. ",www.booking.com/hotel/fr/grenoble-centre.fr.html?label=gen173nr-1FCAQoggJCD3NlYXJjaF9ncmVub2JsZUgNWARoqQGIAQGYAQ24ARjIAQXYAQHoAQH4AQOIAgGoAgS4AvGfnYoGwAIB0gIkNTkyMWU0OTktMGQ4NS00M2E0LWI1YmMtOTM3OTVhNTE5MmY02AIF4AIB&sid=1a531b5936d7b08d2a734b6bc50337d4&dest_id=-1430647&dest_type=city&group_adults=2&group_children=0&hapos=5&hpos=5&no_rooms=1&sr_order=popularity&srepoch=1632063473&srpvid=4b576938424f016e&ucfs=1&from=searchresults;highlight_room=#hotelTmpl,Grenoble
B&B Hôtel Grenoble Centre Alpexpo,7.6,"5.73443546891212,45.158836673882","Le B&B Grenoble Centre Alpexpo est situé à Grenoble, à seulement 800 mètres d'Alpexpo. Doté d'une réception ouverte 24h/24, il propose une connexion Wi-Fi gratuite et des hébergements insonorisés. ",www.booking.com/hotel/fr/b-amp-b-grenoble-centre-alpexpo.fr.html?label=gen173nr-1FCAQoggJCD3NlYXJjaF9ncmVub2JsZUgNWARoqQGIAQGYAQ24ARjIAQXYAQHoAQH4AQOIAgGoAgS4AvGfnYoGwAIB0gIkNTkyMWU0OTktMGQ4NS00M2E0LWI1YmMtOTM3OTVhNTE5MmY02AIF4AIB&sid=1a531b5936d7b08d2a734b6bc50337d4&dest_id=-1430647&dest_type=city&group_adults=2&group_children=0&hapos=6&hpos=6&no_rooms=1&sr_order=popularity&srepoch=1632063473&srpvid=4b576938424f016e&ucfs=1&from=searchresults;highlight_room=#hotelTmpl,Grenoble
Residhotel Grenette,7.7,"5.72448447346687,45.190563627131","Le Residhotel Grenette est situé dans le centre de Grenoble, à 3 minutes à pied de la place Victor Hugo. Il propose un hébergement indépendant avec une connexion Wi-Fi gratuite. ",www.booking.com/hotel/fr/le-royal-grenoble.fr.html?label=gen173nr-1FCAQoggJCD3NlYXJjaF9ncmVub2JsZUgNWARoqQGIAQGYAQ24ARjIAQXYAQHoAQH4AQOIAgGoAgS4AvGfnYoGwAIB0gIkNTkyMWU0OTktMGQ4NS00M2E0LWI1YmMtOTM3OTVhNTE5MmY02AIF4AIB&sid=1a531b5936d7b08d2a734b6bc50337d4&dest_id=-1430647&dest_type=city&group_adults=2&group_children=0&hapos=7&hpos=7&no_rooms=1&sr_order=popularity&srepoch=1632063473&srpvid=4b576938424f016e&ucfs=1&from=searchresults;highlight_room=#hotelTmpl,Grenoble
ibis Styles Grenoble Centre Gare,8.1,"5.71967996656895,45.1908953719989","L'hôtel ibis Styles Grenoble Centre Gare bénéficie d'un emplacement idéal, à seulement 300 mètres de la gare de Grenoble et 400 mètres du centre-ville historique. ",www.booking.com/hotel/fr/all-seasons-grenoble-centre-gare-grenoble.fr.html?label=gen173nr-1FCAQoggJCD3NlYXJjaF9ncmVub2JsZUgNWARoqQGIAQGYAQ24ARjIAQXYAQHoAQH4AQOIAgGoAgS4AvGfnYoGwAIB0gIkNTkyMWU0OTktMGQ4NS00M2E0LWI1YmMtOTM3OTVhNTE5MmY02AIF4AIB&sid=1a531b5936d7b08d2a734b6bc50337d4&dest_id=-1430647&dest_type=city&group_adults=2&group_children=0&hapos=8&hpos=8&no_rooms=1&sr_order=popularity&srepoch=1632063473&srpvid=4b576938424f016e&ucfs=1&from=searchresults;highlight_room=#hotelTmpl,Grenoble
Residhome Grenoble Caserne De Bonne,8.0,"5.72433829307556,45.183469873183","Le Residhome Grenoble Caserne De Bonne est un établissement 4 étoiles situé à Grenoble, à seulement 10 minutes à pied du centre-ville. ",www.booking.com/hotel/fr/residhome-prestige-grenoble-caserne-de-bonne.fr.html?label=gen173nr-1FCAQoggJCD3NlYXJjaF9ncmVub2JsZUgNWARoqQGIAQGYAQ24ARjIAQXYAQHoAQH4AQOIAgGoAgS4AvGfnYoGwAIB0gIkNTkyMWU0OTktMGQ4NS00M2E0LWI1YmMtOTM3OTVhNTE5MmY02AIF4AIB&sid=1a531b5936d7b08d2a734b6bc50337d4&dest_id=-1430647&dest_type=city&group_adults=2&group_children=0&hapos=9&hpos=9&no_rooms=1&sr_order=popularity&srepoch=1632063473&srpvid=4b576938424f016e&ucfs=1&from=searchresults;highlight_room=#hotelTmpl,Grenoble
Kyriad Grenoble Centre,7.9,"5.71199476718903,45.1681999440246","Situé à Grenoble, à 200 mètres du stade Lesdiguières, le Kyriad Grenoble Centre vous accueille dans un hôtel 3 étoiles doté d'une réception ouverte 24h/24 et d'une connexion Wi-Fi gratuite. ",www.booking.com/hotel/fr/qualityhotelgrenoble.fr.html?label=gen173nr-1FCAQoggJCD3NlYXJjaF9ncmVub2JsZUgNWARoqQGIAQGYAQ24ARjIAQXYAQHoAQH4AQOIAgGoAgS4AvGfnYoGwAIB0gIkNTkyMWU0OTktMGQ4NS00M2E0LWI1YmMtOTM3OTVhNTE5MmY02AIF4AIB&sid=1a531b5936d7b08d2a734b6bc50337d4&dest_id=-1430647&dest_type=city&group_adults=2&group_children=0&hapos=10&hpos=10&no_rooms=1&sr_order=popularity&srepoch=1632063473&srpvid=4b576938424f016e&ucfs=1&from=searchresults;highlight_room=#hotelTmpl,Grenoble
Hôtel Vert,8.1,"-1.50961697101593,48.6147004862904","Situé à 2 km du Mont-Saint-Michel, sur la côte normande, l'Hôtel Vert propose des chambres décorées dans des tons pastel dotées d'une salle de bains privative, d'une télévision ainsi que d'une...",www.booking.com/hotel/fr/vert.fr.html?label=gen173nr-1FCAQoggJCGHNlYXJjaF9tb250LXNhaW50LW1pY2hlbEgNWARoqQGIAQGYAQ24ARjIAQXYAQHoAQH4AQOIAgGoAgS4ApugnYoGwAIB0gIkMzU3NWNmMmEtOGVjZi00NTg0LWI0ZDItZmZhYTNkNzljNWI42AIF4AIB&sid=0a90c9c38b89adff2bf6595ee3c2ab1a&dest_id=900039327&dest_type=city&group_adults=2&group_children=0&hapos=1&hpos=1&no_rooms=1&sr_order=popularity&srepoch=1632063515&srpvid=2c45694d98130049&ucfs=1&from=searchresults;highlight_room=#hotelTmpl,Mont-Saint-Michel
Mercure Mont Saint Michel,8.2,"-1.51054501533508,48.6142465295929","Installé dans des espaces verts à seulement 2 km de l'abbaye du Mont-Saint-Michel, le Mercure Mont Saint Michel propose des chambres spacieuses avec salle de bains privative, un bar-restaurant et de...",www.booking.com/hotel/fr/mont-saint-michel.fr.html?label=gen173nr-1FCAQoggJCGHNlYXJjaF9tb250LXNhaW50LW1pY2hlbEgNWARoqQGIAQGYAQ24ARjIAQXYAQHoAQH4AQOIAgGoAgS4ApugnYoGwAIB0gIkMzU3NWNmMmEtOGVjZi00NTg0LWI0ZDItZmZhYTNkNzljNWI42AIF4AIB&sid=0a90c9c38b89adff2bf6595ee3c2ab1a&dest_id=900039327&dest_type=city&group_adults=2&group_children=0&hapos=2&hpos=2&no_rooms=1&sr_order=popularity&srepoch=1632063515&srpvid=2c45694d98130049&ucfs=1&from=searchresults;highlight_room=#hotelTmpl,Mont-Saint-Michel
Le Relais Saint Michel,7.8,"-1.51039615273476,48.6175872716489",Le Relais Saint Michel vous accueille face à la baie du Mont-Saint-Michel. ,www.booking.com/hotel/fr/le-relais-saint-michel.fr.html?label=gen173nr-1FCAQoggJCGHNlYXJjaF9tb250LXNhaW50LW1pY2hlbEgNWARoqQGIAQGYAQ24ARjIAQXYAQHoAQH4AQOIAgGoAgS4ApugnYoGwAIB0gIkMzU3NWNmMmEtOGVjZi00NTg0LWI0ZDItZmZhYTNkNzljNWI42AIF4AIB&sid=0a90c9c38b89adff2bf6595ee3c2ab1a&dest_id=900039327&dest_type=city&group_adults=2&group_children=0&hapos=3&hpos=3&no_rooms=1&sr_order=popularity&srepoch=1632063515&srpvid=2c45694d98130049&ucfs=1&from=searchresults;highlight_room=#hotelTmpl,Mont-Saint-Michel
Les Terrasses Poulard,7.3,"-1.51037871837616,48.6353494256412","Occupant 2 bâtiments différents au cœur du Mont-Saint-Michel, l'établissement historique Les Terrasses Poulard propose des hébergements avec une vue sur la baie, le village et la rue. ",www.booking.com/hotel/fr/les-terrasses-poulard.fr.html?label=gen173nr-1FCAQoggJCGHNlYXJjaF9tb250LXNhaW50LW1pY2hlbEgNWARoqQGIAQGYAQ24ARjIAQXYAQHoAQH4AQOIAgGoAgS4ApugnYoGwAIB0gIkMzU3NWNmMmEtOGVjZi00NTg0LWI0ZDItZmZhYTNkNzljNWI42AIF4AIB&sid=0a90c9c38b89adff2bf6595ee3c2ab1a&dest_id=900039327&dest_type=city&group_adults=2&group_children=0&hapos=4&hpos=4&no_rooms=1&sr_order=popularity&srepoch=1632063515&srpvid=2c45694d98130049&ucfs=1&from=searchresults;highlight_room=#hotelTmpl,Mont-Saint-Michel
Hotel Gabriel,8.1,"-1.5107099711895,48.6153814136834","L'Hotel Gabriel se trouve à 1,6 km du Mont-Saint-Michel et à seulement 25 minutes à pied des remparts de la vieille ville. ",www.booking.com/hotel/fr/hotel-gabriel.fr.html?label=gen173nr-1FCAQoggJCGHNlYXJjaF9tb250LXNhaW50LW1pY2hlbEgNWARoqQGIAQGYAQ24ARjIAQXYAQHoAQH4AQOIAgGoAgS4ApugnYoGwAIB0gIkMzU3NWNmMmEtOGVjZi00NTg0LWI0ZDItZmZhYTNkNzljNWI42AIF4AIB&sid=0a90c9c38b89adff2bf6595ee3c2ab1a&dest_id=900039327&dest_type=city&group_adults=2&group_children=0&hapos=5&hpos=5&no_rooms=1&sr_order=popularity&srepoch=1632063515&srpvid=2c45694d98130049&ucfs=1&from=searchresults;highlight_room=#hotelTmpl,Mont-Saint-Michel
La Mère Poulard,7.3,"-1.51053965091705,48.635085317234","Occupant un bâtiment historique, l'hôtel La Mère Poulard jouit d'un emplacement idéal au cœur du Mont-Saint-Michel. ",www.booking.com/hotel/fr/la-mere-poulard.fr.html?label=gen173nr-1FCAQoggJCGHNlYXJjaF9tb250LXNhaW50LW1pY2hlbEgNWARoqQGIAQGYAQ24ARjIAQXYAQHoAQH4AQOIAgGoAgS4ApugnYoGwAIB0gIkMzU3NWNmMmEtOGVjZi00NTg0LWI0ZDItZmZhYTNkNzljNWI42AIF4AIB&sid=0a90c9c38b89adff2bf6595ee3c2ab1a&dest_id=900039327&dest_type=city&group_adults=2&group_children=0&hapos=6&hpos=6&no_rooms=1&sr_order=popularity&srepoch=1632063515&srpvid=2c45694d98130049&ucfs=1&from=searchresults;highlight_room=#hotelTmpl,Mont-Saint-Michel
Hotel De La Digue,7.1,"-1.51091784238815,48.6168815494412","L'hôtel De La Digue est un établissement traditionnel situé en Normandie, à seulement 5 minutes en navette ou à 30 minutes de marche du Mont-Saint-Michel. ",www.booking.com/hotel/fr/de-la-digue.fr.html?label=gen173nr-1FCAQoggJCGHNlYXJjaF9tb250LXNhaW50LW1pY2hlbEgNWARoqQGIAQGYAQ24ARjIAQXYAQHoAQH4AQOIAgGoAgS4ApugnYoGwAIB0gIkMzU3NWNmMmEtOGVjZi00NTg0LWI0ZDItZmZhYTNkNzljNWI42AIF4AIB&sid=0a90c9c38b89adff2bf6595ee3c2ab1a&dest_id=900039327&dest_type=city&group_adults=2&group_children=0&hapos=7&hpos=7&no_rooms=1&sr_order=popularity&srepoch=1632063515&srpvid=2c45694d98130049&ucfs=1&from=searchresults;highlight_room=#hotelTmpl,Mont-Saint-Michel
