hotel_names,rating,coordinates,description,links,town
Oustaou di Ercole,7.7,"6.3018207,43.1496567","Port Cros, a property with a terrace, is situated in Bormes-les-Mimosas, 5 km from La Favière. Guests staying at this apartment have access to a fully equipped kitchen. ",www.booking.com/hotel/fr/port-cros-bormes-les-mimosas.fr.html?label=gen173nr-1FCAQoggJCGXNlYXJjaF9ib3JtZXMtbGVzLW1pbW9zYXNIDVgEaKkBiAEBmAENuAEYyAEF2AEB6AEB-AEDiAIBqAIEuAK1oJ2KBsACAdICJDQyZDcwYmU2LTE5M2MtNGNjYy05Y2I4LWEyMzI2ZmI5ZTMwY9gCBeACAQ&sid=9521ac4a5151596a27e85cde74beafd8&dest_id=-1413801&dest_type=city&from_beach_non_key_ufi_sr=1&group_adults=2&group_children=0&hapos=7&hpos=7&no_rooms=1&sr_order=popularity&srepoch=1632063542&srpvid=2062695a5c5c0110&ucfs=1&from=searchresults;highlight_room=#hotelTmpl,Bormes-les-Mimosas
Magnifique maison de village clim vue mer 8 pers,7.6,"6.3411234,43.151608","Set in Bormes-les-Mimosas, 3.2 km from La Favière, Magnifique maison de village clim vue mer 8 pers offers a living room with a flat-screen TV. ",www.booking.com/hotel/fr/magnifique-maison-de-village-clim-vue-mer-8-pers.fr.html?label=gen173nr-1FCAQoggJCGXNlYXJjaF9ib3JtZXMtbGVzLW1pbW9zYXNIDVgEaKkBiAEBmAENuAEYyAEF2AEB6AEB-AEDiAIBqAIEuAK1oJ2KBsACAdICJDQyZDcwYmU2LTE5M2MtNGNjYy05Y2I4LWEyMzI2ZmI5ZTMwY9gCBeACAQ&sid=9521ac4a5151596a27e85cde74beafd8&dest_id=-1413801&dest_type=city&from_beach_non_key_ufi_sr=1&group_adults=2&group_children=0&hapos=8&hpos=8&no_rooms=1&sr_order=popularity&srepoch=1632063542&srpvid=2062695a5c5c0110&ucfs=1&from=searchresults;highlight_room=#hotelTmpl,Bormes-les-Mimosas
Villa Bastide de la Mer,8.5,"6.354001,43.120463","Villa Bastide de la Mer has a terrace and is located in Bormes-les-Mimosas, within just less than 1 km of Pointe de Gouron Beach and 500 metres of La Favière. ",www.booking.com/hotel/fr/villa-bastide-de-la-mer.fr.html?label=gen173nr-1FCAQoggJCGXNlYXJjaF9ib3JtZXMtbGVzLW1pbW9zYXNIDVgEaKkBiAEBmAENuAEYyAEF2AEB6AEB-AEDiAIBqAIEuAK1oJ2KBsACAdICJDQyZDcwYmU2LTE5M2MtNGNjYy05Y2I4LWEyMzI2ZmI5ZTMwY9gCBeACAQ&sid=9521ac4a5151596a27e85cde74beafd8&dest_id=-1413801&dest_type=city&from_beach_non_key_ufi_sr=1&group_adults=2&group_children=0&hapos=9&hpos=9&no_rooms=1&sr_order=popularity&srepoch=1632063542&srpvid=2062695a5c5c0110&ucfs=1&from=searchresults;highlight_room=#hotelTmpl,Bormes-les-Mimosas
Maeva Particuliers - Studio 2 personnes plages et criques,8.6,"6.3538607,43.1230903","Le Maeva Particuliers - Studio 2 personnes plages et criques est un hébergement situé à Bormes-les-Mimosas, à 300 mètres de La Favière et à 1,3 km de la plage. Cet appartement dispose d'une...",www.booking.com/hotel/fr/maeva-particuliers-studio-2-personnes-plages-et-criques.fr.html?label=gen173nr-1FCAQoggJCGXNlYXJjaF9ib3JtZXMtbGVzLW1pbW9zYXNIDVgEaKkBiAEBmAENuAEYyAEF2AEB6AEB-AEDiAIBqAIEuAK1oJ2KBsACAdICJDQyZDcwYmU2LTE5M2MtNGNjYy05Y2I4LWEyMzI2ZmI5ZTMwY9gCBeACAQ&sid=9521ac4a5151596a27e85cde74beafd8&dest_id=-1413801&dest_type=city&from_beach_non_key_ufi_sr=1&group_adults=2&group_children=0&hapos=10&hpos=10&no_rooms=1&sr_order=popularity&srepoch=1632063542&srpvid=2062695a5c5c0110&ucfs=1&from=searchresults;highlight_room=#hotelTmpl,Bormes-les-Mimosas
Villa ANTINEA,9.2,"5.5424693,43.2202401","Située à Cassis, à seulement 1,2 km de Bestouan, la Villa ANTINEA propose un casino, une piscine extérieure, une connexion Wi-Fi gratuite et un centre d'affaires. ",www.booking.com/hotel/fr/antinea-cassis12.fr.html?label=gen173nr-1FCAQoggJCDXNlYXJjaF9jYXNzaXNIDVgEaKkBiAEBmAENuAEYyAEF2AEB6AEB-AEDiAIBqAIEuAK3oJ2KBsACAdICJGU2Yzg1MzI3LWQ5MmEtNDU5NS1hMDVjLTBhNjIyNjlhMDAwYdgCBeACAQ&sid=775775396b29031a26a14c4019c1720c&dest_id=-1416912&dest_type=city&from_beach_non_key_ufi_sr=1&group_adults=2&group_children=0&hapos=1&hpos=1&no_rooms=1&sr_order=popularity&srepoch=1632063543&srpvid=07d5695b2f6e0178&ucfs=1&from=searchresults;highlight_room=#hotelTmpl,Cassis
HPC Suites,8.2,"5.5417457245369,43.2164402368568","Offrant une vue sur la mer et installé au sein d'un parc de 4 000 m² dans le centre de Cassis, le HPC Suites possède une piscine extérieure commune entourée d'une terrasse. ",www.booking.com/hotel/fr/hpc-suites.fr.html?label=gen173nr-1FCAQoggJCDXNlYXJjaF9jYXNzaXNIDVgEaKkBiAEBmAENuAEYyAEF2AEB6AEB-AEDiAIBqAIEuAK3oJ2KBsACAdICJGU2Yzg1MzI3LWQ5MmEtNDU5NS1hMDVjLTBhNjIyNjlhMDAwYdgCBeACAQ&sid=775775396b29031a26a14c4019c1720c&dest_id=-1416912&dest_type=city&from_beach_non_key_ufi_sr=1&group_adults=2&group_children=0&hapos=2&hpos=2&no_rooms=1&sr_order=popularity&srepoch=1632063543&srpvid=07d5695b2f6e0178&ucfs=1&from=searchresults;highlight_room=#hotelTmpl,Cassis
MISTRAL by K6 Conciergerie,8.4,"5.53719,43.21537","Installé à Cassis, à 5 km du cap Canaille, le MISTRAL by K6 Conciergerie propose des hébergements avec la climatisation et une connexion Wi-Fi gratuite. ",www.booking.com/hotel/fr/mistral-cassis.fr.html?label=gen173nr-1FCAQoggJCDXNlYXJjaF9jYXNzaXNIDVgEaKkBiAEBmAENuAEYyAEF2AEB6AEB-AEDiAIBqAIEuAK3oJ2KBsACAdICJGU2Yzg1MzI3LWQ5MmEtNDU5NS1hMDVjLTBhNjIyNjlhMDAwYdgCBeACAQ&sid=775775396b29031a26a14c4019c1720c&dest_id=-1416912&dest_type=city&from_beach_non_key_ufi_sr=1&group_adults=2&group_children=0&hapos=3&hpos=3&no_rooms=1&sr_order=popularity&srepoch=1632063543&srpvid=07d5695b2f6e0178&ucfs=1&from=searchresults;highlight_room=#hotelTmpl,Cassis
appartement cosy à 10 mètres du port de Cassis,9.4,"5.53686093325251,43.2153350665985","Situé à Cassis, à 500 mètres des Bestouan et à 5 km du cap Canaille, l'appartement cosy à 10 mètres Le port de Cassis propose une connexion Wi-Fi gratuite et la climatisation. ",www.booking.com/hotel/fr/appartement-cosy-a-10-metres-du-port-de-cassis.fr.html?label=gen173nr-1FCAQoggJCDXNlYXJjaF9jYXNzaXNIDVgEaKkBiAEBmAENuAEYyAEF2AEB6AEB-AEDiAIBqAIEuAK3oJ2KBsACAdICJGU2Yzg1MzI3LWQ5MmEtNDU5NS1hMDVjLTBhNjIyNjlhMDAwYdgCBeACAQ&sid=775775396b29031a26a14c4019c1720c&dest_id=-1416912&dest_type=city&from_beach_non_key_ufi_sr=1&group_adults=2&group_children=0&hapos=4&hpos=4&no_rooms=1&sr_order=popularity&srepoch=1632063543&srpvid=07d5695b2f6e0178&ucfs=1&from=searchresults;highlight_room=#hotelTmpl,Cassis
Cassis Ma Vie Là,8.8,"5.541446,43.216905","Installé à Cassis, à moins de 5 km du cap Canaille, le Cassis Ma Vie Là est un hébergement offrant une vue sur le jardin. ",www.booking.com/hotel/fr/cassis-ma-vie-la.fr.html?label=gen173nr-1FCAQoggJCDXNlYXJjaF9jYXNzaXNIDVgEaKkBiAEBmAENuAEYyAEF2AEB6AEB-AEDiAIBqAIEuAK3oJ2KBsACAdICJGU2Yzg1MzI3LWQ5MmEtNDU5NS1hMDVjLTBhNjIyNjlhMDAwYdgCBeACAQ&sid=775775396b29031a26a14c4019c1720c&dest_id=-1416912&dest_type=city&from_beach_non_key_ufi_sr=1&group_adults=2&group_children=0&hapos=5&hpos=5&no_rooms=1&sr_order=popularity&srepoch=1632063543&srpvid=07d5695b2f6e0178&ucfs=1&from=searchresults;highlight_room=#hotelTmpl,Cassis
appartement du pêcheur à Cassis à 10 mètres du port,8.7,"5.53685819937098,43.2153404647437","Situé à Cassis, à 500 mètres du Bestouan et à 5 km du cap Canaille, l'appartement du pêcheur à Cassis à 10 mètres du port dispose d’une connexion Wi-Fi gratuite, de la climatisation et d’une terrasse....",www.booking.com/hotel/fr/appartement-du-pecheur-a-cassis-a-10-metres-du-port.fr.html?label=gen173nr-1FCAQoggJCDXNlYXJjaF9jYXNzaXNIDVgEaKkBiAEBmAENuAEYyAEF2AEB6AEB-AEDiAIBqAIEuAK3oJ2KBsACAdICJGU2Yzg1MzI3LWQ5MmEtNDU5NS1hMDVjLTBhNjIyNjlhMDAwYdgCBeACAQ&sid=775775396b29031a26a14c4019c1720c&dest_id=-1416912&dest_type=city&from_beach_non_key_ufi_sr=1&group_adults=2&group_children=0&hapos=6&hpos=6&no_rooms=1&sr_order=popularity&srepoch=1632063543&srpvid=07d5695b2f6e0178&ucfs=1&from=searchresults;highlight_room=#hotelTmpl,Cassis
Villa l'Icône,8.2,"5.54760143128283,43.2178835719104","Doté d'une connexion Wi-Fi gratuite et d'un jardin, l'établissement Villa l'Icône est situé à Cassis, à 2,5 km du cap Canaille. Les logements disposent d'une télévision par satellite à écran plat. ",www.booking.com/hotel/fr/villa-l-39-icone.fr.html?label=gen173nr-1FCAQoggJCDXNlYXJjaF9jYXNzaXNIDVgEaKkBiAEBmAENuAEYyAEF2AEB6AEB-AEDiAIBqAIEuAK3oJ2KBsACAdICJGU2Yzg1MzI3LWQ5MmEtNDU5NS1hMDVjLTBhNjIyNjlhMDAwYdgCBeACAQ&sid=775775396b29031a26a14c4019c1720c&dest_id=-1416912&dest_type=city&from_beach_non_key_ufi_sr=1&group_adults=2&group_children=0&hapos=7&hpos=7&no_rooms=1&sr_order=popularity&srepoch=1632063543&srpvid=07d5695b2f6e0178&ucfs=1&from=searchresults;highlight_room=#hotelTmpl,Cassis
Le Duplex,8.6,"5.54057325952454,43.215054769816","Situé à Cassis, à 700 mètres de Bestouan et à 5 km du cap Canaille, l'établissement Le Duplex propose un hébergement climatisé avec un balcon et une connexion Wi-Fi gratuite. ",www.booking.com/hotel/fr/le-duplex-cassis.fr.html?label=gen173nr-1FCAQoggJCDXNlYXJjaF9jYXNzaXNIDVgEaKkBiAEBmAENuAEYyAEF2AEB6AEB-AEDiAIBqAIEuAK3oJ2KBsACAdICJGU2Yzg1MzI3LWQ5MmEtNDU5NS1hMDVjLTBhNjIyNjlhMDAwYdgCBeACAQ&sid=775775396b29031a26a14c4019c1720c&dest_id=-1416912&dest_type=city&from_beach_non_key_ufi_sr=1&group_adults=2&group_children=0&hapos=8&hpos=8&no_rooms=1&sr_order=popularity&srepoch=1632063543&srpvid=07d5695b2f6e0178&ucfs=1&from=searchresults;highlight_room=#hotelTmpl,Cassis
L'ECHO DES FLOTS,8.4,"5.530917756603,43.211915898805","Offrant une vue sur la mer, L'ECHO DES FLOTS propose un hébergement avec une terrasse et une bouilloire, à environ 80 mètres de Bestouan. ",www.booking.com/hotel/fr/echo-des-flots.fr.html?label=gen173nr-1FCAQoggJCDXNlYXJjaF9jYXNzaXNIDVgEaKkBiAEBmAENuAEYyAEF2AEB6AEB-AEDiAIBqAIEuAK3oJ2KBsACAdICJGU2Yzg1MzI3LWQ5MmEtNDU5NS1hMDVjLTBhNjIyNjlhMDAwYdgCBeACAQ&sid=775775396b29031a26a14c4019c1720c&dest_id=-1416912&dest_type=city&from_beach_non_key_ufi_sr=1&group_adults=2&group_children=0&hapos=9&hpos=9&no_rooms=1&sr_order=popularity&srepoch=1632063543&srpvid=07d5695b2f6e0178&ucfs=1&from=searchresults;highlight_room=#hotelTmpl,Cassis
La vigie II,7.9,"5.542284236489,43.213129713983","Offrant une vue sur la montagne, l'hébergement La vigie est situé à Cassis, à 300 mètres de la plage de la Grande Mer et à 650 mètres de celle de l’Arène. ",www.booking.com/hotel/fr/la-vigie-cassis.fr.html?label=gen173nr-1FCAQoggJCDXNlYXJjaF9jYXNzaXNIDVgEaKkBiAEBmAENuAEYyAEF2AEB6AEB-AEDiAIBqAIEuAK3oJ2KBsACAdICJGU2Yzg1MzI3LWQ5MmEtNDU5NS1hMDVjLTBhNjIyNjlhMDAwYdgCBeACAQ&sid=775775396b29031a26a14c4019c1720c&dest_id=-1416912&dest_type=city&from_beach_non_key_ufi_sr=1&group_adults=2&group_children=0&hapos=10&hpos=10&no_rooms=1&sr_order=popularity&srepoch=1632063543&srpvid=07d5695b2f6e0178&ucfs=1&from=searchresults;highlight_room=#hotelTmpl,Cassis
Ibis Budget Marseille Timone,7.2,"5.400739,43.295242","L'Ibis Budget Marseille Timone se trouve à Marseille, à 5 minutes de marche du stade Vallier. La connexion Wi-Fi est gratuite. Vous disposerez d'une salle de bains privative pourvue d'une douche. ",www.booking.com/hotel/fr/ibis-budget-marseille-timone.fr.html?label=gen173nr-1FCAQoggJCEHNlYXJjaF9tYXJzZWlsbGVIDVgEaKkBiAEBmAENuAEYyAEF2AEB6AEB-AEDiAIBqAIEuAK4oJ2KBsACAdICJDRjOTU1ZWRmLTg4YTMtNGMwNy1hNzM2LTc2NjA0ZGU1ZTAzYdgCBeACAQ&sid=b0aaa94b89a0165494fa8f4145054499&dest_id=-1449947&dest_type=city&group_adults=2&group_children=0&hapos=1&hpos=1&no_rooms=1&sr_order=popularity&srepoch=1632063544&srpvid=6d2e695ca81f01cc&ucfs=1&from=searchresults;highlight_room=#hotelTmpl,Marseille
ibis budget Marseille Vieux Port,7.4,"5.37355497479439,43.2922085592384","Situé en plein cœur de Marseille, l’ibis Budget Marseille Vieux Port affiche une façade du XIVe siècle et possède un bar à cocktails. ",www.booking.com/hotel/fr/etap-marseille-vieux-port.fr.html?label=gen173nr-1FCAQoggJCEHNlYXJjaF9tYXJzZWlsbGVIDVgEaKkBiAEBmAENuAEYyAEF2AEB6AEB-AEDiAIBqAIEuAK4oJ2KBsACAdICJDRjOTU1ZWRmLTg4YTMtNGMwNy1hNzM2LTc2NjA0ZGU1ZTAzYdgCBeACAQ&sid=b0aaa94b89a0165494fa8f4145054499&dest_id=-1449947&dest_type=city&group_adults=2&group_children=0&hapos=2&hpos=2&no_rooms=1&sr_order=popularity&srepoch=1632063544&srpvid=6d2e695ca81f01cc&ucfs=1&from=searchresults;highlight_room=#hotelTmpl,Marseille
Toyoko INN Marseille Saint Charles,8.0,"5.376624,43.304229","Situé à Marseille, à seulement 5 minutes à pied de la gare de Marseille Saint-Charles, le Toyoko INN Marseille Saint Charles dispose d’un jardin et d’une connexion Wi-Fi gratuite. ",www.booking.com/hotel/fr/toyoko-inn-marseille-saint-charles.fr.html?label=gen173nr-1FCAQoggJCEHNlYXJjaF9tYXJzZWlsbGVIDVgEaKkBiAEBmAENuAEYyAEF2AEB6AEB-AEDiAIBqAIEuAK4oJ2KBsACAdICJDRjOTU1ZWRmLTg4YTMtNGMwNy1hNzM2LTc2NjA0ZGU1ZTAzYdgCBeACAQ&sid=b0aaa94b89a0165494fa8f4145054499&dest_id=-1449947&dest_type=city&group_adults=2&group_children=0&hapos=3&hpos=3&no_rooms=1&sr_order=popularity&srepoch=1632063544&srpvid=6d2e695ca81f01cc&ucfs=1&from=searchresults;highlight_room=#hotelTmpl,Marseille
Ibis Budget Marseille Prado,6.7,"5.39351142691419,43.2745653701464","Situé à Marseille, l'hôtel ibis Budget Marseille Prado propose une connexion Wi-Fi gratuite dans l'ensemble de ses locaux. ",www.booking.com/hotel/fr/ibis-budget-marseille-prado.fr.html?label=gen173nr-1FCAQoggJCEHNlYXJjaF9tYXJzZWlsbGVIDVgEaKkBiAEBmAENuAEYyAEF2AEB6AEB-AEDiAIBqAIEuAK4oJ2KBsACAdICJDRjOTU1ZWRmLTg4YTMtNGMwNy1hNzM2LTc2NjA0ZGU1ZTAzYdgCBeACAQ&sid=b0aaa94b89a0165494fa8f4145054499&dest_id=-1449947&dest_type=city&group_adults=2&group_children=0&hapos=4&hpos=4&no_rooms=1&sr_order=popularity&srepoch=1632063544&srpvid=6d2e695ca81f01cc&ucfs=1&from=searchresults;highlight_room=#hotelTmpl,Marseille
Hostel Vertigo Vieux-Port,8.1,"5.3719362616539,43.2913973778401","L'Hostel Vertigo Vieux-Port est situé dans le centre de Marseille, à seulement 200 mètres du Vieux-Port. Vous accéderez par un escalier à une chambre quadruple ou un lit dans un dortoir. ",www.booking.com/hotel/fr/vertigo-vieux-port-marseille.fr.html?label=gen173nr-1FCAQoggJCEHNlYXJjaF9tYXJzZWlsbGVIDVgEaKkBiAEBmAENuAEYyAEF2AEB6AEB-AEDiAIBqAIEuAK4oJ2KBsACAdICJDRjOTU1ZWRmLTg4YTMtNGMwNy1hNzM2LTc2NjA0ZGU1ZTAzYdgCBeACAQ&sid=b0aaa94b89a0165494fa8f4145054499&dest_id=-1449947&dest_type=city&group_adults=2&group_children=0&hapos=5&hpos=5&no_rooms=1&sr_order=popularity&srepoch=1632063544&srpvid=6d2e695ca81f01cc&ucfs=1&from=searchresults;highlight_room=#hotelTmpl,Marseille
B&B Hôtel Marseille Centre La Joliette,7.0,"5.36789014935493,43.3049197542308","Bénéficiant d'une connexion Wi-Fi gratuite dans l'ensemble de ses locaux, le B&B Hôtel Marseille Centre La Joliette est situé à seulement 150 mètres de la station de métro La Joliette qui dispose de...",www.booking.com/hotel/fr/b-amp-b-ha-tel-marseille-centre-la-joliette.fr.html?label=gen173nr-1FCAQoggJCEHNlYXJjaF9tYXJzZWlsbGVIDVgEaKkBiAEBmAENuAEYyAEF2AEB6AEB-AEDiAIBqAIEuAK4oJ2KBsACAdICJDRjOTU1ZWRmLTg4YTMtNGMwNy1hNzM2LTc2NjA0ZGU1ZTAzYdgCBeACAQ&sid=b0aaa94b89a0165494fa8f4145054499&dest_id=-1449947&dest_type=city&group_adults=2&group_children=0&hapos=6&hpos=6&no_rooms=1&sr_order=popularity&srepoch=1632063544&srpvid=6d2e695ca81f01cc&ucfs=1&from=searchresults;highlight_room=#hotelTmpl,Marseille
The People Hostel - Marseille,8.4,"5.371282,43.301105","Bénéficiant d'un bel emplacement à Marseille, l'établissement The People Hostel - Marseille propose des chambres climatisées, un bar, une connexion Wi-Fi gratuite et un salon commun. ",www.booking.com/hotel/fr/the-people-hostel-marseille.fr.html?label=gen173nr-1FCAQoggJCEHNlYXJjaF9tYXJzZWlsbGVIDVgEaKkBiAEBmAENuAEYyAEF2AEB6AEB-AEDiAIBqAIEuAK4oJ2KBsACAdICJDRjOTU1ZWRmLTg4YTMtNGMwNy1hNzM2LTc2NjA0ZGU1ZTAzYdgCBeACAQ&sid=b0aaa94b89a0165494fa8f4145054499&dest_id=-1449947&dest_type=city&group_adults=2&group_children=0&hapos=7&hpos=7&no_rooms=1&sr_order=popularity&srepoch=1632063544&srpvid=6d2e695ca81f01cc&ucfs=1&from=searchresults;highlight_room=#hotelTmpl,Marseille
ibis Marseille Centre Euromed,7.9,"5.36782017175824,43.3079010029338","Doté d’un bar, d’un restaurant et d’une terrasse, l’ibis Marseille Centre Euromed propose des hébergements modernes à seulement 2 km du Vieux-Port. Sa réception est ouverte 24h/24. ",www.booking.com/hotel/fr/ibis-euromediterranee.fr.html?label=gen173nr-1FCAQoggJCEHNlYXJjaF9tYXJzZWlsbGVIDVgEaKkBiAEBmAENuAEYyAEF2AEB6AEB-AEDiAIBqAIEuAK4oJ2KBsACAdICJDRjOTU1ZWRmLTg4YTMtNGMwNy1hNzM2LTc2NjA0ZGU1ZTAzYdgCBeACAQ&sid=b0aaa94b89a0165494fa8f4145054499&dest_id=-1449947&dest_type=city&group_adults=2&group_children=0&hapos=8&hpos=8&no_rooms=1&sr_order=popularity&srepoch=1632063544&srpvid=6d2e695ca81f01cc&ucfs=1&from=searchresults;highlight_room=#hotelTmpl,Marseille
ibis Marseille Centre Vieux Port,7.3,"5.37272416055202,43.2994062220049","Situé à 500 mètres du Vieux-Port, l'ibis Marseille Centre Vieux Port propose un hébergement moderne au cœur de Marseille. ",www.booking.com/hotel/fr/ibis-marseille-centre-bourse.fr.html?label=gen173nr-1FCAQoggJCEHNlYXJjaF9tYXJzZWlsbGVIDVgEaKkBiAEBmAENuAEYyAEF2AEB6AEB-AEDiAIBqAIEuAK4oJ2KBsACAdICJDRjOTU1ZWRmLTg4YTMtNGMwNy1hNzM2LTc2NjA0ZGU1ZTAzYdgCBeACAQ&sid=b0aaa94b89a0165494fa8f4145054499&dest_id=-1449947&dest_type=city&group_adults=2&group_children=0&hapos=9&hpos=9&no_rooms=1&sr_order=popularity&srepoch=1632063544&srpvid=6d2e695ca81f01cc&ucfs=1&from=searchresults;highlight_room=#hotelTmpl,Marseille
ibis Marseille Centre Gare Saint Charles,7.6,"5.38222834456974,43.3029435172773","L'ibis Marseille Gare Saint Charles se trouve à 1,6 km du Vieux Port et du quartier Joliette. Cet hôtel dispose d’un bar avec une terrasse équipée d’un terrain de pétanque gratuit. ",www.booking.com/hotel/fr/ibis-marseille-gare-saint-charles.fr.html?label=gen173nr-1FCAQoggJCEHNlYXJjaF9tYXJzZWlsbGVIDVgEaKkBiAEBmAENuAEYyAEF2AEB6AEB-AEDiAIBqAIEuAK4oJ2KBsACAdICJDRjOTU1ZWRmLTg4YTMtNGMwNy1hNzM2LTc2NjA0ZGU1ZTAzYdgCBeACAQ&sid=b0aaa94b89a0165494fa8f4145054499&dest_id=-1449947&dest_type=city&group_adults=2&group_children=0&hapos=10&hpos=10&no_rooms=1&sr_order=popularity&srepoch=1632063544&srpvid=6d2e695ca81f01cc&ucfs=1&from=searchresults;highlight_room=#hotelTmpl,Marseille
ibis budget Aix en Provence,7.8,"5.36888122558594,43.4945301456768","L'ibis budget Aix en Provence est situé en périphérie d'Aix-en-Provence, à 5 km du centre-ville. Ses chambres insonorisées sont munies d'une connexion Wi-Fi gratuite. ",www.booking.com/hotel/fr/etap-aix-en-provence-les-milles.fr.html?label=gen173nr-1FCAQoggJCFnNlYXJjaF9haXgtZW4tcHJvdmVuY2VIDVgEaKkBiAEBmAENuAEYyAEF2AEB6AEB-AEDiAIBqAIEuAK6oJ2KBsACAdICJDM1MDNmMTg0LTA3NDUtNGJkYS1hNDkxLTllNWY4ZWRiOWZlOdgCBeACAQ&sid=26ce89108add237db2326eaf7b163202&dest_id=-1406939&dest_type=city&group_adults=2&group_children=0&hapos=1&hpos=1&no_rooms=1&sr_order=popularity&srepoch=1632063546&srpvid=6a3a695d5d77013f&ucfs=1&from=searchresults;highlight_room=#hotelTmpl,Aix-en-Provence
B&B Hôtel Aix-en-Provence Pont de l'Arc,7.2,"5.4446805,43.5111713","Doté d'une connexion Wi-Fi gratuite, le B&B Hôtel Aix-en-Provence Pont de l'Arc est situé à Aix-en-Provence. Cet établissement 2 étoiles propose des chambres climatisées avec salle de bains privative....",www.booking.com/hotel/fr/b-amp-b-aix-en-provence-pont-de-l-39-arc.fr.html?label=gen173nr-1FCAQoggJCFnNlYXJjaF9haXgtZW4tcHJvdmVuY2VIDVgEaKkBiAEBmAENuAEYyAEF2AEB6AEB-AEDiAIBqAIEuAK6oJ2KBsACAdICJDM1MDNmMTg0LTA3NDUtNGJkYS1hNDkxLTllNWY4ZWRiOWZlOdgCBeACAQ&sid=26ce89108add237db2326eaf7b163202&dest_id=-1406939&dest_type=city&group_adults=2&group_children=0&hapos=2&hpos=2&no_rooms=1&sr_order=popularity&srepoch=1632063546&srpvid=6a3a695d5d77013f&ucfs=1&from=searchresults;highlight_room=#hotelTmpl,Aix-en-Provence
Séjours & Affaires Aix-en-Provence Mirabeau,8.2,"5.44126600027084,43.5252407811275","Cette résidence Séjours & Affaires est située à Aix-en-Provence, à proximité du cours Mirabeau. Elle propose des studios meublés et une connexion Wi-Fi gratuite. ",www.booking.com/hotel/fr/residence-mirabeau.fr.html?label=gen173nr-1FCAQoggJCFnNlYXJjaF9haXgtZW4tcHJvdmVuY2VIDVgEaKkBiAEBmAENuAEYyAEF2AEB6AEB-AEDiAIBqAIEuAK6oJ2KBsACAdICJDM1MDNmMTg0LTA3NDUtNGJkYS1hNDkxLTllNWY4ZWRiOWZlOdgCBeACAQ&sid=26ce89108add237db2326eaf7b163202&dest_id=-1406939&dest_type=city&group_adults=2&group_children=0&hapos=3&hpos=3&no_rooms=1&sr_order=popularity&srepoch=1632063546&srpvid=6a3a695d5d77013f&ucfs=1&from=searchresults;highlight_room=#hotelTmpl,Aix-en-Provence
ibis Aix en Provence,7.9,"5.46482384204865,43.511386825341","L'Hotel Ibis Aix en Provence est situé dans un cadre verdoyant, à 2 km du centre-ville. Il dispose d'une piscine extérieure et d'un restaurant sur place. ",www.booking.com/hotel/fr/hatel-ibis-aix-en-provence.fr.html?label=gen173nr-1FCAQoggJCFnNlYXJjaF9haXgtZW4tcHJvdmVuY2VIDVgEaKkBiAEBmAENuAEYyAEF2AEB6AEB-AEDiAIBqAIEuAK6oJ2KBsACAdICJDM1MDNmMTg0LTA3NDUtNGJkYS1hNDkxLTllNWY4ZWRiOWZlOdgCBeACAQ&sid=26ce89108add237db2326eaf7b163202&dest_id=-1406939&dest_type=city&group_adults=2&group_children=0&hapos=4&hpos=4&no_rooms=1&sr_order=popularity&srepoch=1632063546&srpvid=6a3a695d5d77013f&ucfs=1&from=searchresults;highlight_room=#hotelTmpl,Aix-en-Provence
Campanile Aix-en-Provence Sud - Pont de l'Arc,7.5,"5.43665394186974,43.5119163169588","Situé à Aix-en-Provence, à 3 km du centre historique et du cours Mirabeau, le Campanile Aix-en-Provence Sud - Pont de l'Arc propose des chambres climatisées avec une connexion Wi-Fi gratuite, ainsi...",www.booking.com/hotel/fr/campanile-aix-en-provence-sud.fr.html?label=gen173nr-1FCAQoggJCFnNlYXJjaF9haXgtZW4tcHJvdmVuY2VIDVgEaKkBiAEBmAENuAEYyAEF2AEB6AEB-AEDiAIBqAIEuAK6oJ2KBsACAdICJDM1MDNmMTg0LTA3NDUtNGJkYS1hNDkxLTllNWY4ZWRiOWZlOdgCBeACAQ&sid=26ce89108add237db2326eaf7b163202&dest_id=-1406939&dest_type=city&group_adults=2&group_children=0&hapos=5&hpos=5&no_rooms=1&sr_order=popularity&srepoch=1632063546&srpvid=6a3a695d5d77013f&ucfs=1&from=searchresults;highlight_room=#hotelTmpl,Aix-en-Provence
Hôtel Vendôme,8.0,"5.43827533721924,43.5289120479536","Situé à deux pas du centre historique d'Aix-en-Provence et du magnifique Pavillon de Vendôme, cet hôtel propose des chambres insonorisées, climatisées et équipées d'une télévision à écran plat avec...",www.booking.com/hotel/fr/ha-tel-vendome.fr.html?label=gen173nr-1FCAQoggJCFnNlYXJjaF9haXgtZW4tcHJvdmVuY2VIDVgEaKkBiAEBmAENuAEYyAEF2AEB6AEB-AEDiAIBqAIEuAK6oJ2KBsACAdICJDM1MDNmMTg0LTA3NDUtNGJkYS1hNDkxLTllNWY4ZWRiOWZlOdgCBeACAQ&sid=26ce89108add237db2326eaf7b163202&dest_id=-1406939&dest_type=city&group_adults=2&group_children=0&hapos=6&hpos=6&no_rooms=1&sr_order=popularity&srepoch=1632063546&srpvid=6a3a695d5d77013f&ucfs=1&from=searchresults;highlight_room=#hotelTmpl,Aix-en-Provence
Aix Hotel,6.5,"5.37147223949432,43.491782639093","L’Aix Hotel est situé dans le quartier des affaires d’Aix-en-Provence, à proximité de la zone d’activités Europôle de l’Arbois. ",www.booking.com/hotel/fr/tit-dej-aix-en-provence.fr.html?label=gen173nr-1FCAQoggJCFnNlYXJjaF9haXgtZW4tcHJvdmVuY2VIDVgEaKkBiAEBmAENuAEYyAEF2AEB6AEB-AEDiAIBqAIEuAK6oJ2KBsACAdICJDM1MDNmMTg0LTA3NDUtNGJkYS1hNDkxLTllNWY4ZWRiOWZlOdgCBeACAQ&sid=26ce89108add237db2326eaf7b163202&dest_id=-1406939&dest_type=city&group_adults=2&group_children=0&hapos=7&hpos=7&no_rooms=1&sr_order=popularity&srepoch=1632063546&srpvid=6a3a695d5d77013f&ucfs=1&from=searchresults;highlight_room=#hotelTmpl,Aix-en-Provence
Maison Alfred - Boulegon,8.0,"5.4495514,43.5310588","Située à 1,7 km de la cathédrale Saint-Sauveur, la Maison Alfred - Boulegon propose des hébergements avec un balcon et une terrasse. ",www.booking.com/hotel/fr/alfred-boulegon-sur-cours.fr.html?label=gen173nr-1FCAQoggJCFnNlYXJjaF9haXgtZW4tcHJvdmVuY2VIDVgEaKkBiAEBmAENuAEYyAEF2AEB6AEB-AEDiAIBqAIEuAK6oJ2KBsACAdICJDM1MDNmMTg0LTA3NDUtNGJkYS1hNDkxLTllNWY4ZWRiOWZlOdgCBeACAQ&sid=26ce89108add237db2326eaf7b163202&dest_id=-1406939&dest_type=city&group_adults=2&group_children=0&hapos=8&hpos=8&no_rooms=1&sr_order=popularity&srepoch=1632063546&srpvid=6a3a695d5d77013f&ucfs=1&from=searchresults;highlight_room=#hotelTmpl,Aix-en-Provence
Hôtel Le Mozart,8.6,"5.45787155628204,43.5219176232722","Situé à 500 mètres du musée Granet, l'Hôtel Le Mozart propose des chambres climatisées avec connexion Wi-Fi gratuite. Il est facilement accessible depuis l'autoroute A8, à 3 minutes de route. ",www.booking.com/hotel/fr/le-mozart.fr.html?label=gen173nr-1FCAQoggJCFnNlYXJjaF9haXgtZW4tcHJvdmVuY2VIDVgEaKkBiAEBmAENuAEYyAEF2AEB6AEB-AEDiAIBqAIEuAK6oJ2KBsACAdICJDM1MDNmMTg0LTA3NDUtNGJkYS1hNDkxLTllNWY4ZWRiOWZlOdgCBeACAQ&sid=26ce89108add237db2326eaf7b163202&dest_id=-1406939&dest_type=city&group_adults=2&group_children=0&hapos=9&hpos=9&no_rooms=1&sr_order=popularity&srepoch=1632063546&srpvid=6a3a695d5d77013f&ucfs=1&from=searchresults;highlight_room=#hotelTmpl,Aix-en-Provence
Le Concorde,8.1,"5.45375436544418,43.5246122210145","Le Concorde est idéalement situé dans le centre d’Aix-en-Provence, à seulement 5 minutes à pied du célèbre cours Mirabeau et à proximité du musée Granet. Cet établissement possède un jardin fleuri. ",www.booking.com/hotel/fr/le-concorde-sarl-aix-en-provence.fr.html?label=gen173nr-1FCAQoggJCFnNlYXJjaF9haXgtZW4tcHJvdmVuY2VIDVgEaKkBiAEBmAENuAEYyAEF2AEB6AEB-AEDiAIBqAIEuAK6oJ2KBsACAdICJDM1MDNmMTg0LTA3NDUtNGJkYS1hNDkxLTllNWY4ZWRiOWZlOdgCBeACAQ&sid=26ce89108add237db2326eaf7b163202&dest_id=-1406939&dest_type=city&group_adults=2&group_children=0&hapos=10&hpos=10&no_rooms=1&sr_order=popularity&srepoch=1632063546&srpvid=6a3a695d5d77013f&ucfs=1&from=searchresults;highlight_room=#hotelTmpl,Aix-en-Provence
Hôtel Le Bristol,8.1,"4.80533167719841,43.9440321278147","Idéalement situé à l’intérieur des remparts du centre d’Avignon, l’Hôtel Le Bristol vous propose des chambres climatisées, un bar, une connexion Wi-Fi gratuite et un salon commun. ",www.booking.com/hotel/fr/hotel-bristol-avignon.fr.html?label=gen173nr-1FCAQoggJCDnNlYXJjaF9hdmlnbm9uSA1YBGipAYgBAZgBDbgBGMgBBdgBAegBAfgBA4gCAagCBLgCvKCdigbAAgHSAiQ2NDM1OWMzMy0xNTAzLTRmYTYtYjAxYi02N2Q4OTUzZTJmMmLYAgXgAgE&sid=9f64e997988a2b57cf11f1b8ce896930&dest_id=-1409631&dest_type=city&group_adults=2&group_children=0&hapos=1&hpos=1&no_rooms=1&sr_order=popularity&srepoch=1632063548&srpvid=a66e695ee5910132&ucfs=1&from=searchresults;highlight_room=#hotelTmpl,Avignon
